{
  "schema_version": 1,
  "tiers": {
    "core": "Auto-run on first boot, and by default when a human runs provision.sh with no flags. The minimum for a working headless appliance.",
    "extended": "Opt-in developer/workstation tooling. Requires --tier=extended or an interactive confirmation.",
    "hardware": "Installed only when matching hardware is detected. Never flag-gated — gated by detection (see core/lib/gpu-detect.sh).",
    "reserved": "Documented as part of the ecosystem but not implemented by CI-OS itself — owned by a separate repo. Exists so the manifest is a complete map of the ecosystem, not just of what this repo happens to install."
  },
  "dev_tools": [
    {"id": "docker", "tier": "core", "role": "containerization", "services": ["docker"]},
    {"id": "uv", "tier": "core", "installer": {"method": "curl_script", "url": "https://astral.sh/uv/install.sh"}},
    {"id": "homebrew", "tier": "extended", "note": "Only used today as an apt fallback path for a couple of tools; not required for a working appliance."},
    {"id": "asdf", "tier": "core"},
    {"id": "node", "tier": "core", "version": "22.15.1", "via": "asdf"},
    {"id": "bun", "tier": "extended", "note": "Demoted from an inconsistent state (present in the ISO's auto-run path, explicitly removed from setup-fresh-ubuntu.sh with \"no longer required\"). No component in this repo requires Bun at build or run time — CI-Hub ships as a prebuilt Docker image, and there is no bun.lockb/bunfig.toml anywhere in-tree."},
    {"id": "gh", "tier": "core"},
    {"id": "cloudflared", "tier": "core"},
    {"id": "vscode", "tier": "extended"},
    {"id": "tailscale", "tier": "core"},
    {"id": "chromium", "tier": "extended"},
    {"id": "telemetry_removal", "tier": "core"},
    {"id": "ci_user", "tier": "core", "note": "Creates the 'ci' system user, adds it to the docker group."},
    {"id": "rocm", "tier": "hardware", "hardware_match": "amd_gpu_strix_halo"},
    {"id": "lact", "tier": "hardware", "hardware_match": "amd_gpu"}
  ],
  "llm": {
    "provider": "ollama",
    "tier": "core",
    "models": ["nomic-embed-text", "gemma3:1b", "qwen3:4b"]
  },
  "ecosystem": {
    "ci_hub": {
      "tier": "core",
      "display_name": "CI Hub Service",
      "note": "The Docker/Runtipi backend (ci-os-hub container, port 5002). Gated on registry auth + device pairing by design — that's a legitimate business requirement, not a bug. When credentials/pairing are absent, the step must report a single clear message and exit cleanly rather than attempting a silent fallback.",
      "registry": "portal.companionintelligence.com",
      "image": "ci-os-hub:latest",
      "requires_secrets": ["REGISTRY_USERNAME", "REGISTRY_PASSWORD"],
      "optional_pairing": ["DEVICE_ID", "API_KEY"],
      "optional_secrets": ["TUNNEL_TOKEN"]
    },
    "companion_launcher": {
      "tier": "extended",
      "display_name": "Companion Launcher",
      "note": "Renamed from \"Companion Hub Desktop\" to resolve the 3-way \"Hub\" naming collision (see docs/architecture/multi-distro-design.md). A native/Electron GUI launcher app, unrelated to the ci_hub backend above beyond opening a browser tab to it.",
      "installer": {"method": "external_deb", "source": "https://dl.ci.computer"}
    },
    "ci_server": {
      "tier": "reserved",
      "implemented_here": false,
      "owning_repo": "CI-Server",
      "note": "CI-Server has no implementation in CI-OS and no real spec to integrate against yet. This entry exists so the manifest is a complete map of the platform's ecosystem, not an invitation to build a placeholder integration ahead of the real repo defining its own provisioning story."
    }
  }
}
